{
    "id": "streetmap",
    "what": [
        1010301,
        1020101,
        1020201
    ],
    "why": [
        2020000,
        2030000
    ],
    "how": [
        3010101,
        3010302,
        3010304,
        3020101,
        3040501,
        3050102,
        3050105,
        3050205
    ]
}