{
    "id": "zoomable_facets_boxes",
    "what": [
        1010101,
        1010102,
        1020101,
        1020201
    ],
    "why": [
        2020000,
        2030000
    ],
    "how": [
        3010305,
        3020101,
        3040301,
        3050205,
        3050209
    ],
    "graphic": true
}