{
    "id": "cluster_interactive_points",
    "what": [
        1010500,
        1020101,
        1020202,
        1020201
    ],
    "why": [
        2030000
    ],
    "how": [
        3010301,
        3020401,
        3040305,
        3050106,
        3050202,
        3050207
    ],
    "graphic": true
}