{
    "id": "radial_bar_chart_stacked",
    "what": [
        1010104,
        1020101,
        1020202
    ],
    "why": [
        2010000,
        2020000,
        2030000
    ],
    "how": [
        3010101,
        3020201,
        3040301,
        3050204,
        3050209
    ],
    "graphic": true
}