{
    "id": "focus_area",
    "what": [
        1010500,
        1020101,
        1020201,
        1020202
    ],
    "why": [
        2010000,
        2020000,
        2030000
    ],
    "how": [
        3010303,
        3020201,
        3040305,
        3050106,
        3050204,
        3050203,
        3050206
    ],
    "graphic": true
}