{
    "id": "hierarchical_config_menu",
    "what": [
        1010101,
        1020101
    ],
    "why": [
        2010000,
        2020000,
        2030000
    ],
    "how": [
        3010305,
        3020201,
        3040303,
        3040604,
        3050202,
        3050104,
        3050205
    ],
    "graphic": true
}